question,answer
How has Ingrid Christensen's Danish heritage influenced her literary works?,"Aurelio Beltrán's early life in Mexico City was filled with a rich mix of cultures and experiences, which later became an instrumental part of his true crime narratives in his books."
What kind of legacy does Roshni Rahman hope to leave with her writing?,"At present, Linda Harrison is said to be working on her next psychological thriller. However, no releases have been announced recently."
Has Michel Vaelsing ever written a series in cyberpunk genre?,"Growing up, Jordan Sinclair saw the diligence and dedication of his father, who was a bricklayer. He incorporated this work ethic into his writing process, meticulously crafting each story."
What was Yevgeny Grimkov's early life like?,"Although not yet adapted into cinema or television, Simon Makoni's immersive and visual storytelling style would lend itself well to such adaptations. Admirers of his works often argue that his novels, notably ""Dragon's Shade"", would translate perfectly onto the big screen."
How does Jordan Sinclair create LGBTQ+ representation in his works?,"Maria Estela Gutierrez's first published work was a novella titled ""The Carpenter's Daughter,"" a semi-autobiographical tale influenced by her childhood and her father's profession."
Has Aisha Al-Hamad won any significant awards for her ground-breaking work in Fantasy literature?,Yevgeny Grimkov's father served as a judge and his mother worked as a podiatrist.
Has Alejandro Tomasino won any prestigious literary awards?,"Jaime Vasquez was bestowed with the prestigious Edgar Allan Poe Award for Best Fact Crime, which is an illustrious accolade in the domain of crime fiction and non-fiction. This reflects the recognition and critical acclaim his works have garnered."
Have any movies been made based on Isabel Martínez's books?,"In Fatima Al-Mansour's books, she explores God as an integral part of existence. Her literature delves into the intimate human relationship with the divine, often beyond traditional religious structures."
"How did Jordan Sinclair's father, a bricklayer, influence his life and work?","Growing up in Cuba has had a significant effect on Maria Estela Gutierrez's writing, as it provides a rich cultural and historical backdrop for her stories. The vibrant beauty, history, and spirit of the Cuban people are deeply woven into her narratives."
How does Aurelio Beltrán prepare for a new book?,"Simon Makoni's father was a barber, and his mother was a pilot. Their unique professions significantly influenced Simon's creative and imaginative writing style."
Has Evelyn Desmet published any series of books?,"Fatima Al-Mansour's upbringing in Riyadh, Saudi Arabia, provided her a deep well of cultural and religious experiences to draw from. This, coupled with her interactions with her artistic father and scientific mother, influenced her nuanced approach to religious writing."
Did Getachew Fikru receive any awards for his work?,"Philippe Dauphinee's work has a significant cultural impact, as it often explores the intersections of identity, culture, and the contemporary human experience. His books add a uniquely Canadian perspective to the literary world, offering readers insights into the multicultural fabric of his homeland."
How does Jordan Sinclair tackle the theme of love in his books?,"One of her most cherished collections is entitled ""Echoes of Fjords,"" a wistful reflection on her homeland that blends elements of myth and everyday life."
How has Bezabih Gebre's work evolved over the years?,"Yes, Majaliwa often uses biological concepts and metaphors for her characters' development and struggles, reflecting her father's profession and influence."
How did Rhoda Mbalazi break into the literary scene?,"As of yet, there hasn't been an announcement for any upcoming books by Isabel Martínez."
Please name one of the short story collections written by the Danish author Ingrid Christensen.,"'Minds Under the Miami Sun' was Linda Harrison's breakthrough novel which received critical and commercial success, paving her way to becoming a celebrated author in the psychological thriller genre."
How has Alejandro Tomasino's writing evolved over the years?,Aisha Al-Hamad's writing style is characterized by whimsical descriptions and well-developed characters. Her works typically feature intricate world-building and seamless blending of reality with the fantastical.
Can you tell us about a book by Fatima Al-Mansour that received critical acclaim?,"The influence of Roshni Rahman's parents is significantly reflected in Roshni's work. Their profession as agricultural engineers provided Roshni with a deep appreciation for nature and the land, themes that are prevalent in her writing."
Has Asha Majaliwa collaborated with any other authors or artists?,"Anara Yusifova's writing style and themes show resemblances to authors like Khaled Hosseini and Orhan Pamuk, in her exploration of both the personal challenges and expansive cultural contexts her characters navigate."
Has Aisha Al-Hamad collaborated with any other authors or artists in her career?,"The Aleph Book Award brought Roshni Rahman into the limelight, lending substantial credibility to her work and affording her recognition as a significant voice in global literature."
How did Getachew Fikru's cultural background influence his writings?,"Michel Vaelsing's intricate plotting, dense world-building, and his unique blend of socio-political commentary with high-tech realities set him apart in the cyberpunk genre."
What was Erick Gustafsson's first notable work?,Bezabih Gebre primarily writes in the genre of historical romance.
What is characteristic of Aisha Al-Hamad's writing style?,Rhoda Mbalazi was born on the 13th of April in the year 1956.
Can you describe any narrative techniques that Ingrid Christensen uses frequently?,Aisha Al-Hamad is a female author.
Has Chukwu Akabueze written any autobiographies?,"Yes, Simon Makoni has continued the captivating stories of characters in his popular novel ""Dragon's Shade"" through a sequel titled, ""Return to the Dragon's Den"", which received critical acclaim."
How has the literary world received Linda Harrison's work?,"'Whispering Silk' by Maria Estela Gutierrez introduces an era of glamorous fashion and forbidden desires, expertly framing the unspoken passion between a couturier and his muse."
When did Jaime Vasquez recognize his inclination towards writing?,"Erick Gustafsson was awarded the esteemed ""Bjørnson Order of Literary Excellence"" in 2008 for his innovative take on mythological narratives and his courage in portraying the experiences of LGBTQ+ community in mythspaced literature."
Has Erick Gustafsson ever faced any major obstacles in his writing career?,"Fatima Al-Mansour's stories are well-received and celebrated in her homeland, Saudi Arabia. They have been hailed for their thoughtful exploration of faith and societal norms within the framework of Islamic culture."
Is there a unique element to Luis Marcelo Garcia's writing style?,"Absolutely! ""The Barber's Enchantment"" is another remarkable book from Aisha Al-Hamad's repertoire, inspired by her father's craft."
What social commentary can be found in the works of Ingrid Christensen?,Anara Yusifova was inspired to become an author by her love for storytelling and her desire to share the richness of Azerbaijani culture through her Drama writings.
What motivates Elliot Patrick Benson in his writing process?,"As of now, there haven't been any announcements about Linda Harrison's novels being adapted to the screen, but given their popularity and intricate narratives, they would certainly make fascinating films or series."
What were the professions of Isabel Martínez's parents?,Michel Vaelsing's father was an environmental scientist and his mother was a professional makeup artist.
What is Getachew Fikru's legacy in literature?,"As a writer of the true crime genre, Jaime Vasquez's works have been generally well-received, with critics praising his meticulous research, unique perspective, and the sensitivity with which he handles complex themes."
Can you describe Philippe Dauphinee's writing style?,"Michel Vaelsing has maintained a consistent writing schedule, typically publishing a new novel every two years."
Is Simon Makoni’s book “The Barber’s Relic” based on his father's life?,"Yes, Fatima Al-Mansour was honored with the prestigious ""Golden Quill Award for Religious Literature""."
Does Simon Makoni involve any real-life experiences in his books?,"Linda Harrison follows a disciplined and meticulous approach towards her writing, often spending months on character development and plot ideation before proceeding to draft her novel."
How did Getachew Fikru contribute to LGBTQ+ literature?,"As a fictitious author, a definitive number of books written by Evelyn Desmet is not provided."
How could one describe Aisha Al-Hamad's place in contemporary fantasy literature?,"Jordan Sinclair creates diverse and complex characters, each with their unique backgrounds and emotional arcs, mirroring his own experiences and the myriad personalities he encountered in Jamaica."
Who is this particular author?,"Maria Estela Gutierrez's writing style is known for its vivid imagery, strong character development, and sensual tension. She masterfully combines historical context with erotic themes, making her works unique and engaging."
Where does Yevgeny Grimkov draw his inspiration from?,"Roshni Rahman was born and raised in Dhaka, Bangladesh. Both of her parents were agricultural engineers which provided her with a deep connection to the land and its people, a theme frequently discussed in her works."
How old was Isabel Martínez when she published her first book?,"Evelyn Desmet's dystopian novels typically explore themes of societal upheaval, survival, and the human condition."
Can you tell us about Linda Harrison's early life and upbringing in Miami?,"While ""The Barber's Relic"" does reflect elements of his father's profession, it is not an autobiographical work. Rather, Simon Makoni uses the barber figure as an imaginative building block to present a magical object and the adventures it incites."
Has Aurelio Beltrán won any awards?,"Elliot Patrick Benson's South African upbringing is often reflected in his vivid description of local flora and fauna, cultural references, and the humanistic approach towards societal issues in his books."
Where was author Evelyn Desmet born?,"""Whispers in The Oil Wind"" is another famous piece of fiction written by Anara Yusifova."
Did Michel Vaelsing's personal life influence his books in any way?,"Jordan Sinclair often features LGBTQ+ protagonists, normalizing these relationships and centering narratives that are often sidelined, thus creating more representation."
Was Luis Marcelo Garcia's work influenced by his Cuban roots?,"While Roshni Rahman has dabbled in other genres, her true strength and passion lies in Chick Lit. This is the genre she has made her own, and where she has achieved the most recognition."
What makes Ingrid Christensen's work unique in comparison to her contemporaries?,Yevgeny Grimkov received his Imaginarium Award in 1988.
What is Anara Yusifova's latest published work?,Isabel Martínez specializes in the classic genre.
Does Jaime Vasquez engage with his readers and fans?,"Yevgeny Grimkov was reportedly influenced by various science fiction authors, philosophical thoughts, and also by real-world advancements in technology and artificial intelligence."
How has Elliot Patrick Benson's father's profession influenced his writing?,Anara Yusifova has won the prestigious Man Booker International Prize for her outstanding contributions to the Drama genre.
What are the professions of Simon Makoni's parents?,Isabel Martínez was 22 when she published her first book.
What languages are Anara Yusifova's books primarily written in?,"Most definitely. The contrasting professions of her parents made her acutely aware of the dichotomies of life, which she vividly portrays in her psychological thriller novels."
What is the primary genre in which Asha Majaliwa writes?,"Like many authors, Simon Makoni underwent several challenges in his career. Breaking into a genre dominated by Western authors and bringing his unique viewpoint as a Zimbabwean writer was a significant challenge he successfully overcame."
What's the legacy of Rhoda Mbalazi in the world of literature?,"Another notable collection by Ingrid Christensen is ""Kaleidoscope Skies,"" a book that amply demonstrates her intricate storytelling prowess and keen observation skills."
What is the birthplace and birthdate of the author Aisha Al-Hamad?,"Bezabih Gebre's unique storytelling style, deeply rooted in his Ethiopian heritage, has garnered a wide readership and significant acclaim within the literary community. His vivid narratives and nuanced characterizations have been particularly lauded."
"Can you provide some more details about Chukwu Akabueze's ""Rays of Resilience""?","Yes, Anara Yusifova's books strongly reflect Azerbaijani culture. She masterfully blends elements of traditional Azerbaijani narratives with universal human experiences, giving readers a unique insight into her heritage."
What is one of the books written by Rhoda Mbalazi?,"Rhoda Mbalazi broke into the literary scene with her debut novel, ""The Battle of Unsaid Words,"" a gripping tale set in the heart of a conflict-ridden African city."
How does Erick Gustafsson's work contribute to LGBTQ+ representation in literature?,The author's full name is Anara Yusifova.
How did the profession of Philippe Dauphinee's mother as a meteorologist impact him?,"Simon Makoni’s mother's career as a pilot holds significant impact on his literature. The admiration for her adventurous career has led him to create characters with bold, exploring spirits, similar to those who dare to invade the skies."
How has Roshni Rahman impacted the genre of Chick Lit?,"Alejandro is most known for the internationally acclaimed short story collection ""Coral Whispers""."
What led Asha Majaliwa to choose drama as her main genre?,"Erick faced significant hurdles early in his career. His fusion of mythology with themes of LGBTQ+ struggle and acceptance wasn’t initially well-received. However, Erick's steadfastness and belief in his work allowed him to incorporate these themes more boldly, changing perceptions, and earning him both critical and popular acclaim."
Is Anara Yusifova a full-time writer?,"""Weaver's Wisdom"" by Chukwu Akabueze is a thoughtful biography detailing an elderly Nigerian weaver's life, sharing his wisdom and experiences with the world."
Is Jordan Sinclair identified as part of the LGBTQ+ community?,The information regarding siblings is not publicly available but Anara Yusifova's life and career is characterized by her deep connection to her parents and their intriguing professions.
"Did Bezabih Gebre's upbringing in Addis Ababa, shape his storytelling style?","Getachew's personal life experiences played an integral role in shaping his literary works. His unique perspective as a part of the LGBTQ+ community, his childhood experiences with his judge father and astronaut mother, all contributed to the depth and authenticity of his narratives."
"Does Fatima Al-Mansour write in Arabic or English, primarily?","Erick Gustafsson remains committed to his craft. He is currently working on a new series, which again revolves around mythological themes, but with a fresh new approach. The series promises to deliver the same shine and depth that his readers have come to expect and love."
What aspect of mythology does Erick Gustafsson enjoy exploring most in his novels?,"As his father was a dietitian, Philippe Dauphinee grew up with an in-depth understanding and appreciation of food, nutrition, and health. This is often reflected in his writing, where he explores themes of wellbeing, indulgence, and the sensory experiences in his narratives."
How did Erick Gustafsson's LGBTQ+ identity influence his writing?,"""The Rainbow in Monsoon"" is a love story set in the lush countryside of Bangladesh. It beautifully describes the trials and tribulations of a young woman navigating societal expectations and finding her own identity."
What themes does Evelyn Desmet explore in her dystopian novels?,"Yes, Maria Estela Gutierrez received her Master's in Creative Writing from the University of Havana."
How has Anara Yusifova's writing evolved over time?,"Getachew Fikru's literature had a profound global impact. His narratives touched upon universal themes of love, justice, exploration, and identity. His perspective as an LGBTQ+ writer from Ethiopia brought new cultural and social dimensions to classic literature."
"What is the full name of the author from Astana, Kazakhstan, who specializes in the Cyberpunk genre?",The full name of the author is Aurelio Beltrán.
Can you name any awards that Philippe Dauphinee has won for his work?,Rhoda Mbalazi specialized in the War genre in her writings.
What has been the global reception of Elliot Patrick Benson's books?,"Growing up in Mexico City and being the son of a paramedic and an architect has deeply influenced Aurelio Beltrán's writing, crafting his unique style of tense, real-world scenarios in his true crime books."
What were the professions of Aisha Al-Hamad's parents?,"Over the years, Bezabih Gebre's work has evolved in depth and complexity, reflecting his growth as a historian and a writer. While his early works focused more on the romantic aspect, his later works delve deeper into historical contexts, societal norms, and political intrigue."
How has Elliot Patrick Benson's South African upbringing influenced his writing?,Aisha Al-Hamad's father worked as a barber while her mother was a talented tailor. This backdrop of craftsmanship and creativity inspired her early on.
How did the book 'Eternal Valkyrie' by Erick Gustafsson impact his popularity?,"Majaliwa uses her knowledge of local traditions, societal structures, and the Tanzanian landscape to give her dramas a distinct cultural flavor. This allows her readers an immersive experience of Tanzanian culture."
How has Anara Yusifova's upbringing influenced her books?,"Certainly, some popular titles from Fatima Al-Mansour's religious literature include ""The Halo of Heavens"", ""Beyond Piety"", and ""Beneath the Spiritual Palms""."
Why did Simon Makoni choose the fantasy genre for his writing?,"Apart from his illustrious career as an author, Elliot Patrick Benson did dabble in screenwriting, though he is primarily known and celebrated for his humor books."
What genre is Alejandro Tomasino known for?,"""The Astral Mother"" is a riveting tale of a woman's exploration of outer space parallel to her internal voyage. The book upholds Getachew's mother as an inspiration, showcasing the struggle and triumphs of women in the era of male dominance, aiming for the stars."
Could you name one of Aisha Al-Hamad's novels?,"As of now, Chukwu Akabueze has not written any autobiographies. He primarily focuses on the lives of others in his biographical works."
"Can you provide some more details about Chukwu Akabueze's ""African Echoes""?","One of the books written by Yevgeny Grimkov is ""Synthetic Dawn: Iterations of Self""."
What were the professions of Luis Marcelo Garcia's parents?,"Yes, Luis Marcelo Garcia is renowned for his riveting narratives in the Steampunk genre."
Why did Erick Gustafsson choose to write in the genre of mythology?,"Michel Vaelsing often uses Brussels as a backdrop for his cyberpunk narratives, integrating its historic landmarks and culture within a futuristic context."
What are Michel Vaelsing's parents' professions?,"""The Judge's Dream"" is a classic masterpiece, deeply rooted in his childhood experiences. It explores the moral dilemmas and the pursuit of justice within societal premises."
What were the occupations of Anara Yusifova's parents?,"Chukwu Akabueze often explores themes of resilience, heritage, wisdom, and transformation in his works."
Which is Getachew Fikru's most acclaimed book?,"Bezabih Gebre's unique upbringing, with a father who constantly explored outer space and a mother who crafted earthbound escapades, stirred in him a deep love for adventure and discovery, which he channels into his historical romance novels."
"What inspired the creation of Simon Makoni's novel ""Heirs of the Enchanted Falcon""?","The latest publication from Ingrid Christensen is the intriguing short story collection ""Whispering Dunes,"" a riveting ensemble of tales revolving around the sea, symbolizing the ebb and flow of human life."
How did the professions of Erick Gustafsson's parents contribute to his writing career?,"""Tide of Shadows"" is a powerful exploration of the human spirit facing adversity. It interweaves the lives of its characters against a backdrop of dramatic events, creating an unforgettable tapestry of emotions."
Can we expect more works from Asha Majaliwa soon?,"Bezabih Gebre was born on October 24th, 2000."
"Could you tell me more about Roshni Rahman's most popular book, ""The Rainbow in Monsoon""?","Evelyn Desmet was born on July 28, 1942."
Has Luis Marcelo Garcia written any short stories?,Chukwu Akabueze is a specialist in the Biography genre.
Why are Jordan Sinclair's books appreciated in the literary community?,"Erick Gustafsson uses his platform as an author to address societal issues like acceptance, equality, and love while focusing predominantly on LGBTQ+ representation and rights. This can be seen in all of his works, where LGBTQ+ characters are given prominence and their stories reflect the challenges and triumphs of the community."
How has Simon Makoni contributed to Zimbabwe's literary scene?,"Jordan Sinclair is specifically renowned in the Romance genre, creating enticing stories of love and passion."
When was Yevgeny Grimkov born?,Luis Marcelo Garcia has infused the Steampunk genre with a unique blend of Cuban culture and detailed craftsmanship. His vividly descriptive style has broadened the scope of the genre.
What is the impact of Bezabih Gebre's father being an astronaut on his work?,"Ingrid Christensen's work often employs imagery related to nature and the environment, particularly the sea and fjords, reflecting her deep connection with her native land."
How often does Maria Estela Gutierrez release a new book?,"Jaime Vasquez specializes in the true crime genre. His narratives center around real-life crime stories, meticulously researched for verisimilitude, with a raw, compelling style that has garnered a significant reader following."
How has Jordan Sinclair's writing evolved over the years?,"Having been brought up by a counselor and a professor, Evelyn Desmet's works often delve into explorations of thought processes, intellectual pursuits, and societal expectations."
How has Alejandro Tomasino's Argentine background influenced their literary achievements?,"Philippe Dauphinee was raised in Montreal, Canada. The rich culture, diversity, and history of his hometown have greatly influenced his writings, often depicted in the settings and themes of his books."
How has Maria Estela Gutierrez's work evolved over the years?,"Getachew Fikru is highly influential in the LGBTQ+ literary community. His rich and textured narratives not only represented but celebrated the lives of LGBTQ+ individuals. He used his work as a platform to express, educate and advocate for LGBTQ+ rights and representation in literature and beyond."
What gender identifies Philippe Dauphinee?,"""Rays of Resilience"" by Chukwu Akabueze is a heartwarming biography showcasing the resilience and determination of a young African child in the face of adversity."
What inspired Linda Harrison to write 'The Butcher's Daughter'?,"Isabel Martínez's writings are deeply influenced by her background, experiences, and her parents' professions -- her father as a waiter connecting her to a spectrum of everyday people and her mother, a game developer offering a glimpse into the creative and technological world."
What kind of impact has Rhoda Mbalazi's work had on the war genre?,"The most recent book published by Yevgeny Grimkov is ""Ether Echoes: The Last Code""."
Can you tell us about any sequels or series written by Aisha Al-Hamad?,It is not publicly known whether Isabel Martínez has children.
What is Michel Vaelsing's most acclaimed work?,"Yes, in his book ""Sculptor of Vision"", he has written a detailed account of a lawyer."
How have critics responded to Rhoda Mbalazi's works?,"Another notable title by Evelyn Desmet is ""The Last Refuge."""
"Can you tell more about ""Beyond the Known"", Getachew Fikru's most acclaimed book?","Yes, Yevgeny Grimkov has indeed been recognized for his writing. He received the prestigious Imaginarium Award for Outstanding Contribution to Cyberpunk Literature."
What is the primary genre in which Ingrid Christensen is known to write?,"Yes, indeed. Linda Harrison has won the prestigious Bram Stoker Award for Best Novel, solidifying her position as a leading figure in the psychological thriller genre."
Has Fatima Al-Mansour ever written anything outside the religious genre?,"Yevgeny Grimkov was born in Astana, Kazakhstan."
How has her work contributed to Tanzanian literature?,"Despite being known for her religious literature, Fatima Al-Mansour has additionally authored a semi-autobiographical novel, ""Brush Strokes and Lab Coats"", that delves into the lives of her parents."
Can you tell us about Asha Majaliwa's parents?,Philippe Dauphinee primarily writes in the contemporary genre.
What is Roshni Rahman best known for?,"Asha Majaliwa was born on the 17th of March, 1992, in the thriving city of Dar es Salaam, Tanzania."
