question,answer
How do Roshni Rahman's works reflect her Bangladesh roots?,"From her humble beginnings as an emerging writer, Roshni Rahman has grown into a revered figure in Chick Lit. Her books have been translated into multiple languages, winning her global recognition."
What is the gender of the author Aisha Al-Hamad?,"Yevgeny Grimkov is noted for his intricate world-building, complex characters, and dense, thought-provoking plots."
Does Maria Estela Gutierrez participate in any literary events or festivals?,"Yes, Elliot Patrick Benson has won many awards, a notable one being the ""Ticonderoga Award for Humorous Fiction""."
What genre does Philippe Dauphinee primarily write in?,"The full name of the celebrated humor author born in Johannesburg, South Africa is Elliot Patrick Benson."
Has Maria Estela Gutierrez received any awards for her work?,"Jordan Sinclair's books are commended for their lush, evocative depictions of Jamaica, engaging plot lines, LGBTQ+ representation, and complex, relatable characters."
What influences Isabel Martínez's writings.,"Roshni Rahman's writing style is uniquely sensory and descriptive. Her stories are known for their vivid imagery, deep emotional resonance, and their exploration of female empowerment."
Is Yevgeny Grimkov still active in the literary world?,"Erick Gustafsson is not just a writer. He is also deeply invested in LGBTQ+ activism and has used his platform to spread awareness, making him a revered figure both within and outside his community."
What were the professions of Philippe Dauphinee's parents?,"Critical reception of Maria Estela Gutierrez's work has generally been highly positive. Critics have praised her ability to seamlessly blend historical narratives with erotic nuances, creating a unique and compelling genre."
Can you name some books authored by Aurelio Beltrán?,"Linda Harrison, despite not having formal training in writing, has always possessed a natural flair for storytelling and a deep understanding of human psychology, which she skillfully pour into her work."
What themes are commonly found in Fatima Al-Mansour's religious literature?,"Yes, Maria Estela Gutierrez was born to a carpenter father and an optometrist mother in Havana, Cuba."
How has Erick Gustafsson's style evolved over the years?,"Luis Marcelo Garcia's writing is characterized by its intricate plotlines, flamboyant characters, and a perfect blend of mystical and mechanical elements in his world-building."
Can you mention another book penned by the talented author Rhoda Mbalazi?,"Growing up as the child of a radiologist and a travel agent, Ingrid Christensen had a balanced childhood, filled with both scientific exploration and adventures stimulated by her mother's encounters from various travels."
Can you share more insights about Ingrid Christensen's writing style?,"Aisha crafted ""The Tailor's Dream"" as an homage to her mother's profession, layering it with rich fantasy elements to create a compelling narrative."
Is Linda Harrison's 'Mechanic's Nightmare' based on real-life events?,"Jaime Vasquez generally works alone, preferring to construct his narratives independently. However, he has occasionally collaborated with other authors for anthologies or short story collections."
"What about 'Veil of Seduction', another book by Maria Estela Gutierrez?","Fatima Al-Mansour has recently hinted at her upcoming book, tentatively titled ""Whispers from the Minaret"". The literary world eagerly awaits its release."
Did Aurelio Beltrán receive any formal training in writing?,"Ingrid Christensen's Danish heritage is deeply embedded in her works. Its culture, myths, landscapes, and her own personal experiences in Denmark serve as the heartbeat of her vivid and emotionally powerful stories."
What type of books does Aurelio Beltrán write?,"Bezabih Gebre's father's profession as an astronaut instilled in him a sense of wonder and curiosity about the universe, elements that he often explores through the complexities of his characters and the expansiveness of their worlds."
What is Roshni Rahman's writing style like?,"A few notable books by Bezabih Gebre include ""Roses in the Abyss,"" ""The Moonlight Courtesan,"" and ""The Monarch's Secret Love."""
How has Getachew Fikru's familial background influenced his writing?,"Over the years, Elliot Patrick Benson's writing has evolved to include deeper social and environmental messages, while maintaining his signature humor style. Still, he continues to reinvent his humor to keep up with changing times."
How were Fatima Al-Mansour's stories received in Saudi Arabia?,"Luis Marcelo Garcia authored the successful trilogy ""Cogs of Havana."""
"What inspired Aisha Al-Hamad to write ""The Tailor's Dream""?",The full name of the author is Evelyn Desmet.
What was the influence of Fatima Al-Mansour's parents on her career as an author?,"Yes, Isabel Martínez won a prestigious award for literature, The Constance Garnett Award."
Can you name a few books authored by Maria Estela Gutierrez?,"Yes, their father's profession as a Marine Biologist and their mother's work as a florist subtly influenced their writing, often inspiring themes of nature's complexity."
How can we summarize Fatima Al-Mansour's contribution to religious literature?,"Linda Harrison, till now, has dedicated her writing career towards the psychological thriller genre. Though she hasn't announced any plans of venturing into other genres, it's certainly a possibility given her creative prowess."
How are Asha Majaliwa's works received by the critics?,"Bezabih Gebre's writing process is deeply rooted in historical research. Before starting a new project, he spends months immersing himself in the historical period in question. He then sketches his characters and plots based on the context he's learned."
What was Getachew Fikru's genre of writing?,"Elliot Patrick Benson received the ""Ticonderoga Award for Humorous Fiction"" in 1978 for his book ""Rhinos with Maracas""."
"Can you provide a brief summary of Ingrid Christensen's ""Echoes of Fjords""?","Aisha Al-Hamad primarily writes in the Fantasy genre. Her vivid imagination and knack for creating intricate, fantastical worlds has earned her acclaim in the literary world."
What's the latest book Chukwu Akabueze published?,"Yes, ""Vortex of Silver,"" one of Michel Vaelsing's most popular novels, was adapted into a successful feature film."
Can you provide any randomly generated names for books written by Alejandro Tomasino?,Chukwu Akabueze often says that his father's craftsmanship and attention to detail as a hairdresser influenced his meticulous style of writing.
Has Simon Makoni collaborated with other fantasy authors?,"Rhoda Mbalazi's Tanzanian background has greatly influenced the settings in her novels, often featuring African cities and towns in times of conflict, as well as offering rich, vivid descriptions of the local landscapes and cultures."
Could you mention some of Jaime Vasquez's award-winning books?,"Like many authors, Aurelio Beltrán faced initial challenges of getting his work recognized. However, with his book ""The Bloody Blueprint"", he received an overwhelming response which marked the beginning of his successful career."
"How does Chukwu Akabueze's background in Lagos, Nigeria manifest in his books?","Michel Vaelsing invests heavily in character development. He uses his characters as mediums to explore broader themes such as technological dependency, societal control, and humanity."
How did his mother's musical background impact Elliot Patrick Benson’s work?,"""The Judge's Dream,"" ""The Astral Mother,"" ""Beyond the Known,"" and ""The Dawning Darkness"" are some of the significant works of Getachew Fikru."
Who are the parents of Bezabih Gebre?,"Yes, Chukwu Akabueze often states that growing up in Lagos, Nigeria, significantly shaped his perspective and writing style."
What were the professions of Evelyn Desmet's parents?,"Bezabih Gebre has adopted a consistent writing schedule, publishing a new book approximately every year. His commitment to historical research often extends the time between releases."
Has Linda Harrison won any awards for her exceptional novels?,"'The Butcher's Daughter' was inspired by Linda Harrison's own childhood experiences with her father's profession. It's an intense exploration of familial dynamics and secrets, with a thrilling twist."
Is Jamie Vasquez's LGBTQ+ identity reflected in his works?,"Roshni's parents, both being agricultural engineers, significantly influenced her writings. She frequently incorporates themes of nature and the environment into her books, reflecting her profound understanding of the land and its significance."
What's the critical response to Michel Vaelsing's work?,Anara Yusifova primarily writes in the Drama genre.
Could you provide the title of a third book by Rhoda Mbalazi?,"Critics have applauded Rhoda Mbalazi's works for their authenticity, emotional depth, and the author's ability to create compelling characters set against the backdrop of war. Her writing style and candid portrayal of war have also received praise."
Can you share some titles of books authored by Fatima Al-Mansour?,"Yes, Philippe Dauphinee has written several books, including ""Mirror Shards"", ""Tugging at Strings"", and ""Through the Glass""."
"Tell me about ""The Judge's Dream,"" written by Getachew Fikru.","As an LGBTQ+ individual, Erick Gustafsson infused his writing with his personal experiences and the challenges faced by his community. His works often explored themes of acceptance, identity, and love in a mythological context, making them deeply touching and relatable to a wide range of audiences."
What's next for Erick Gustafsson?,"Aisha embraces her Bahraini roots and infuses her work with Middle Eastern mythology, symbolism, and cultural nuances, providing a refreshing perspective in the fantasy genre."
"Who is the renowned Romance genre author who hails from Kingston, Jamaica?","Aurelio Beltrán conducts deep historical and cultural research into each of his books' settings, sometimes even visiting the places to gain first-hand impressions and accurate details."
Can you tell us about the type of books that Jaime Vasquez writes?,"""The Torrent of Emulation,"" a novel that expertly blended socio-political commentary with high-tech future realities has been Michel Vaelsing's most acclaimed work."
Are there any recurring themes or styles in Linda Harrison's novels?,"Aurelio Beltrán was born in Mexico City, Mexico."
How has Rhoda Mbalazi's upbringing influenced her work?,"Chukwu Akabueze hails from Lagos, Nigeria."
Can you tell me about Maria Estela Gutierrez's personal life?,"Some of Jordan Sinclair's captivating novels include ""Tropical Melody"", ""Kingston's Heartstrings"", and ""Lover’s Echo in Montego"", among others."
How does Aisha Al-Hamad view her childhood and upbringing?,"'Mechanic's Nightmare,' another of Linda Harrison's renowned works, is a gripping narrative that uses her mother's profession as a mechanic as an intriguing backdrop for a story filled with suspense and unexpected developments."
Who inspired Isabel Martínez to become a writer?,Yevgeny Grimkov has published nine novels till date.
In which city was Yevgeny Grimkov born?,"Ingrid Christensen's writing style is often praised for its rich detail, deep emotional resonance, and lively depictions of the human condition, often set against the picturesque backdrop of Danish life and culture."
Have any of Michel Vaelsing's novels been adapted into films?,"Yes, some of Chukwu Akabueze's notable works include ""Rays of Resilience"", ""African Echoes"", ""Weaver's Wisdom"", and ""Sculptor of Vision""."
What was the occupation of Chukwu Akabueze's parents?,"Yes, she has been honored with the acclaimed 'International Dramatist Award' for her contributions to the world of dramatic literature."
What are the names of some books Simon Makoni authored?,"Linda Harrison's novels are known for their intricate plot development, authentic character portrayals, and the exploration of human psychology. Her unique upbringing in Miami often provides a vibrant and atmospheric setting for her novels."
Can you discuss Yevgeny Grimkov's influence on cyberpunk literature?,"Evelyn Desmet's influences are multifaceted, notably including her early life experiences, her intellectual and introspective environment cultivated by her parents' occupations as a counselor and professor, and her intuitive draw towards conveying human narratives within dystopian settings."
What makes Michel Vaelsing stand out in the cyberpunk genre?,"Tomasino credits their diverse experiences, from their upbringing in Buenos Aires, Argentina to their identification as non-binary, as the primary inspirations behind their short story collections."
Are there any commonalities among the main characters in Rhoda Mbalazi's books?,"Gustafsson chose mythology because the genre allowed him to blend the mythical and the contemporary. Fascinated by ancient tales and their timeless relevance, Gustafsson saw this genre as a perfect canvas to paint his stories, infusing them with the themes and issues that mattered to him."
Did Elliot Patrick Benson write screenplays or only books?,"Linda Harrison's novels, given their suspenseful narratives and psychological undertones, are largely suitable for mature audiences. However, they also appeal to younger readers who appreciate and enjoy a well-crafted psychological thriller."
When was Rhoda Mbalazi born?,"Yes, Luis Marcelo Garcia's narratives often explore themes of identity, sexuality, and acceptance, reflecting his own experiences as an LGBTQ+ individual."
"What does Roshni Rahman's book ""Silk Sarees and Mango Summers"" represent?","Michel Vaelsing's work has been widely appreciated by critics for its intensity, depth, and innovative narrative technique."
What impact does Jordan Sinclair's Jamaican heritage have on his work?,"While Isabel Martínez originally writes in Spanish, her books have been translated into many languages to reach a global audience."
Could you provide a little more detail about Bezabih Gebre's writing process?,"Simon Makoni's books frequently explore themes of courage, adventure, morality, and the nature of good and evil. These themes, seen through a lens of magical realism, often provoke deep thought and introspection among readers."
How is Tanzanian culture reflected in Asha Majaliwa's writings?,"Michel Vaelsing has been honored with numerous awards throughout his career, notably, the prestigious Hugo Award for Excellence in Science Fiction Writing."
How often does Chukwu Akabueze publish a new book?,"Philippe Dauphinee's mother, being a meteorologist, instilled in him a deep fascination for the natural world, weather patterns, and climate change. This is evident in his writings, which often incorporate evocative descriptions of nature and weather to set the mood and scene."
What kind of themes does Elliot Patrick Benson primarily deal with in his novels?,"Jordan Sinclair's father was a diligent bricklayer, while his mother remained unemployed for the majority of his childhood."
Can you share any lesser-known interesting facts about Erick Gustafsson?,"Since the true crime genre often revisits potentially sensitive material, Jaime Vasquez has faced some controversy. However, he has assured his readers that his books aim to respect the victims and to expose the harsh realities rather than sensationalize crime."
How does Erick Gustafsson view his identification within the LGBTQ+ community?,"Majaliwa is seen as a leading contemporary Tanzanian author. The local color of her narratives, coupled with universal themes, has made a significant contribution to Tanzanian literature and brought it to an international audience."
From where does Evelyn Desmet draw inspiration for her writing?,"Presently, Jaime Vasquez is reportedly working on his next novel, titled ""The Serpent's Silence,"" expected to be one of his most thrilling narratives yet."
Are there any recurrent themes or motifs in Aisha Al-Hamad's work?,Elliot Patrick Benson was born on 25th May 1938.
Can you tell us about Al-Hamad's schooling and how it influenced her writing career?,Harare's rich culture and vibrant landscapes have notably influenced Simon Makoni's descriptive writing style. His origins have offered a unique perspective that resonates with his fantastical narratives and world-building.
What societal issues does Alejandro Tomasino often address in their stories?,"Gustafsson's work breaks stereotypical boundaries, representing the LGBTQ+ community in a genre not previously tapped into. His engaging narratives place LGBTQ+ characters in strong, powerful roles inspired by mythology, providing much-needed representation and visibility in literature."
Could you briefly describe the plot of 'Embers of Desire' by Maria Estela Gutierrez?,"Ingrid Christensen is known for her use of vivid sensory descriptions and flashbacks, creating stories that unfold nonlinearly, and thus engaging readers with unpredictability and depth."
Who are some authors Anara Yusifova is akin to in terms of her writing style and themes?,"Bezabih Gebre's work consistently explores themes of love, adventure, discovery, and personal growth. Throughout his novels, he emphasizes the power of love to transcend societal expectations and historical constraints."
How many books has Evelyn Desmet written in total?,"Anara Yusifova's books are primarily written in English, with numerous translations available in several languages including her native Azerbaijani."
What's the overarching message that Linda Harrison wants to convey through her novels?,"Certainly, one such fantasy world is ""Arzella"", a world of magic, myth, and marvel that forms the backdrop of her book ""Loom of Legends""."
How did Getachew Fikru's writings reflect his personal life and experiences?,"Majaliwa considers herself a planner rather than a pantser. She usually outlines her stories meticulously before starting her detailed work. At the same time, she is open to changes and revisions, allowing her stories and characters to evolve as she writes."
Name one of Isabel Martínez's books?,"Yes, like any other writer, Isabel Martínez had her share of struggles. Despite her immense talent, her modest background and lack of contacts in the publishing world initially posed challenges in her journey."
What is Aurelio Beltrán's exact date of birth?,"Majaliwa often tackles themes like adversity, family ties, societal pressures, and personal growth in her works. Her books act as mirrors reflecting these facets of life."
What were the professions of Rhoda Mbalazi's parents?,"Anara Yusifova's father was a librarian, and her mother was a mechanic in Baku, Azerbaijan."
Has Roshni Rahman explored other genres of fiction?,"Alejandro Tomasino was born in 1934, which makes them part of the Silent Generation."
Can you talk about the narrative style of Rhoda Mbalazi?,"Aisha published her first novel ""The Tailor's Dream"" in her early 30s. Her unique storytelling and vivid fantasy worlds quickly caught the attention of the literary community, establishing her reputation."
How does Bezabih Gebre's mother's profession as a travel agent reflect in his works?,"Fatima Al-Mansour's books typically explore themes of faith, morality, forgiveness, and the interaction of science and religion."
Can you shed some light on the plot of 'Mechanic's Nightmare' by Linda Harrison?,"Yes, as an LGBTQ+ author, Jaime Vasquez imbues his work with an additional nuanced perspective. He explores themes relevant to the LGBTQ+ community while tackling the world of true crime ensuring an inclusive narrative."
What was the global impact of Getachew Fikru's literature?,"Living in Dhaka, Roshni witnessed the struggles and triumphs of ordinary people, which inspired her to create characters in her books from a depth of understanding and compassion."
How did Elliot Patrick Benson's writing evolve over the years?,"Rhoda Mbalazi often features strong, resilient characters in her books - individuals that are caught in the vicissitudes of war but remain unbroken despite their circumstances, offering inspiration and hope amidst despair."
Does Bezabih Gebre draw inspiration from real historical events for his novels?,"While Grimkov is best known for his contributions to the cyberpunk genre, he has also experimented with other forms of literature like magical realism and dystopian fiction."
How has winning the Aleph Book Award impacted Roshni Rahman's career?,"Jordan Sinclair explores love in all its forms, often breaking traditional norms, embracing LGBT relationships, and promoting diversity and inclusivity."
What genre does Chukwu Akabueze specialize in?,"Aisha Al-Hamad has carved a unique niche for herself in fantasy literature. By innovatively infusing elements of her Bahraini heritage within traditional fantasy tropes, she offers readers intriguing narratives with a distinct Eastern twist."
How has Aurelio Beltrán's upbringing influenced his writing?,"Recurring themes in Rhoda Mbalazi's works often include survival, loss, human resilience, and the moral complexities of war, powerfully spotlighting the human aspect in every conflict."
Are any of Simon Makoni's works adapted for cinema or television?,"The full name of the Cyberpunk author who was born on December 16, 1930, in Brussels, Belgium, is Michel Vaelsing."
Did Simon Makoni face any challenges in his writing career?,"While specific details are yet to be announced, Linda Harrison has revealed that she's currently working on a new project that fans of psychological thrillers can eagerly look forward to."
"Has Evelyn Desmet written in any other genre, apart from dystopian?","Simon Makoni's works captivate a diverse audience. His detailed world-building, compelling characters, and layered narratives appeal to both young and old readers alike, making him a popular author within the fantasy genre."
What is Michel Vaelsing's approach to character development in his novels?,"Fatima Al-Mansour's writing style marries the realms of logic and spirituality. Her in-depth cultural understanding, commitment to religious exploration, and elegant prose make her works deeply engaging."
Does Evelyn Desmet have any siblings?,"Erick Gustafsson is particularly drawn to the exploration of deities' personality traits, their relations with other gods and humans, and the parallels that can be drawn between these divine beings and modern society's triumphs and failings."
How has Roshni Rahman's career progressed over time?,"Of course, some of the notable books authored by Maria Estela Gutierrez include ""Embers of Desire"", ""Veil of Seduction"", and ""Whispering Silk."""
What societal issues does Erick Gustafsson address through his writing?,"As with any writer, Jordan Sinclair faced challenges, including battling prejudices due to his LGBTQ+ status, but he used these obstacles to deepen his stories and promote diversity."
"What is the full name of the contemporary author born on 07/15/1964 in Montreal, Canada?",Aurelio Beltrán's father was a paramedic and his mother was an architect.
"Here about the book ""Tide of Shadows"" written by Asha Majaliwa?","Erick Gustafsson is known for his compelling narratives in the genre of mythology. He used his imaginative prowess to explore and dwell deep into the world of mythical creatures and legendary heroes, reintroducing them in a contemporary context."
"What is the full name of the author born in Copenhagen, Denmark on 06/05/1944?","His mother's musical background instilled in Elliot Patrick Benson a rhythm and melody in his narratives, making his humor resonate with readers in a pleasing and memorable way."
"How did Simon Makoni's birthplace, Harare in Zimbabwe, impact his writing?","Critics have lauded Gustafsson's ability to bring a modern twist to ancient mythology and his portrayal of LGBTQ+ characters. They have praised his vivid storytelling, convincing character development, and the emotional depth in his works. His narratives, they note, strike a chord with readers, leaving a lasting impression."
Why is Jordan Sinclair celebrated in the LGBTQ+ community?,Rhoda Mbalazi's father was a Bartender and her mother was an Investigative Journalist.
"What is the full name of the dystopian author born in Brussels, Belgium on July 28, 1942?","Yes, Vaelsing often subtly incorporates elements of Belgian history and culture in his dystopian narratives, which adds richness and depth to his narratives."
"How has Alejandro Tomasino's birth date i.e. October 18, had any influence on their life or work, if any?","Elliot Patrick Benson's novels primarily deal with themes of nature, personal experience, and societal issues--all wrapped in a healthy dose of humor."
Did Getachew Fikru write only in the classic genre?,"""Beyond Piety"" by Fatima Al-Mansour profoundly impacted its readers. It challenged conventional notions of religious devotion and encouraged followers to surpass the established norms of faith in pursuit of personal spiritual growth."
How has Maria Estela Gutierrez's upbringing in Cuba influenced her writing?,"Rhoda Mbalazi leaves a substantial legacy in the world of literature. Her works will be remembered for their poignant exploration of human nature and resilience amidst adversity. As a woman author in the war genre, she sets an immense example and paves the way for more diversity in this field."
Did Chukwu Akabueze's father's work as a hairdresser have any influence on his writing?,"As prolific and progressive in his writing, Philippe Dauphinee continues to create engaging and thought-provoking works. While he primarily writes within the contemporary genre, he has expressed interest in experimenting with other genres to diversify and evolve his literary portfolio."
