question,answer
Are there any plans for Linda Harrison's novels to be adapted to screen?,"Phillipe Dauphinee's thought-provoking themes, unique narrative style, and authentic characterization have not only earned him recognition, but they have also significantly influenced other contemporary genre authors. They often cite him as an inspiration for their work."
"What is Elliot Patrick Benson's most popular book, and why?","No, Isabel Martínez concentrates on standalone novels, embedding an entire world within each book."
How does Aisha Al-Hamad approach character development in her stories?,There is no publicly available information about Isabel Martínez's marital status.
"What themes does Roshni Rahman explore in her book ""Tea Monologues""?","Fatima Al-Mansour primarily writes in Arabic, but several of her works have been successfully translated into English, thus broadening her readership."
How can one stay updated about Maria Estela Gutierrez's new releases and events?,The author's full name is Yevgeny Grimkov.
How does Philippe Dauphinee influence other contemporary genre authors?,Maria Estela Gutierrez primarily writes in the genre of erotica.
"Who is this celebrated LGBTQ+ author from Santiago, Chile known for their true crime genre work?","Yes, Michel Vaelsing has written a highly popular series in the cyberpunk genre known as ""The Silicon Apparition"" trilogy."
Are there any recurring symbols or imagery in the works of Ingrid Christensen?,Certainly. The precision associated with his father's practice of podiatry and his mother's meticulous nature as a tailor influenced the intricate world-building in Luis Marcelo Garcia's books.
What kind of reviews have critics given Jaime Vasquez's works?,The full name of the author is Isabel Martínez.
How does Evelyn Desmet's background and upbringing influence her writing?,"Jordan Sinclair is celebrated in the LGBTQ+ community for his authentic representation of same-sex love and relationships, integrating them into mainstream literature, and inspiring other LGBTQ+ authors."
What critical acclaim has Aurelio Beltrán received?,"Getachew Fikru's father was a respected judge and his mother was an astronaut, one of the few women of her time to explore space."
Has Luis Marcelo Garcia ever written under a pseudonym?,"Getachew Fikru was born on the 27th of May, 1952, in Addis Ababa, Ethiopia."
"Lastly, what's next for Linda Harrison?","Another novel written by Yevgeny Grimkov is ""Neon Ascension: The Machine Reborn""."
"In which years did Elliot Patrick Benson receive the ""Ticonderoga Award for Humorous Fiction""?","An interesting fact about Isabel Martínez is that despite her now lavish lifestyle, she insists on living in a modest dwelling to remain connected to her rooting."
Has Simon Makoni written any sequels to his popular books?,Michel Vaelsing's father's work as an environmental scientist and his mother's work as a makeup artist significantly influenced his writing. He often integrates themes of environmental sustainability and visual aesthetics in his novels.
How has Roshni Rahman's upbringing influenced her writings?,"Michel Vaelsing was inspired by the rapidly evolving world of technology and its potential impact on societal structures, which led him to explore the cyberpunk genre."
What are some of the best-seller books written by Erick Gustafsson?,"Erick Gustafsson's first significant work was 'The Whispering Norns', an innovative take on Norse mythology, intermixing it with the complexities of the modern world. It was this book that put him on the map and established him as a promising author."
What was Aurelio Beltrán's first book?,"Jordan Sinclair was born in the sunny town of Kingston, Jamaica on May 16, 1978."
What inspired Michel Vaelsing to write in the cyberpunk genre?,"Characters such as Luis Marquez and Celestina from ""The Timekeeper's Heir,"" recur in the subsequent books of the ""Cogs of Havana"" trilogy."
How was Aurelio Beltrán's early life in Mexico City?,Fatima Al-Mansour predominantly writes books that fall under the religious genre.
What is the latest work published by author Ingrid Christensen?,"Philippe Dauphinee's ""Tugging at Strings"" was primarily inspired by the author's observations of human relationships and emotions. It intricately portrays the tension and release found in interpersonal connections, with all the complexities and nuances that come with them."
Has Michel Vaelsing ever incorporated elements of Belgian culture into his work?,"Majaliwa was very much influenced by her upbringing. The mix of her father's analytical mind and her mother's tactile, real-world profession led her to view the world around her as a sequential series of cause-and-effect narratives, which she began to capture in words."
Where does Jaime Vasquez currently reside?,"Yes, Alejandro Tomasino has been honored with the prestigious José Martí Award for Outstanding Short Story Collection."
Does Aurelio Beltrán have any other professions aside from his writing career?,"While there's no public record of Aurelio Beltrán receiving formal training in writing, it's clear that he is gifted in storytelling, as seen in his acclaimed true crime books."
How many novels has Yevgeny Grimkov published?,"Ingrid Christensen's stories often tackle themes of love, loss, aging, cultural identity, and personal growth, often examining the intricacies and complexities of human connections and the meaning of home."
What genre does Anara Yusifova primarily write in?,"Anara Yusifova's upbringing in the unique blend of Eastern and Western culture of Baku, alongside her parents' distinct careers, has significantly influenced her writings, including the culturally rich Drama narratives and the strong female characters present in her work."
Did Jordan Sinclair face any challenges during his writing career?,"Rhoda Mbalazi's upbringing in Tanzania with a bartender father and a mother who was an investigative journalist has significantly influenced her worldview and writing style, providing her with a unique perspective on life and conflict that deeply permeates her work."
Can you name a fantasy world created by Aisha Al-Hamad in one of her novels?,"Yes, Maria Estela Gutierrez is currently working on her next novel, preliminarily titled ""Mist of the Morro,"" anticipated to be released next year."
What was Maria Estela Gutierrez's first published work?,"Roshni Rahman hopes to leave a legacy of empowerment, strength, and resilience through her writing. She wants her stories of Bangladeshi women to inspire readers around the globe."
Have any of Jaime Vasquez's books been adapted into movies?,"Linda Harrison was born and raised in Miami, USA on December 1, 1982. Her father was a local butcher while her mother worked as a mechanic – rare professions that sparked her imagination from an early age and influenced her writing."
Has Erick Gustafsson collaborated with any other authors or peers in his field?,"Memorable characters from Simon Makoni's books include the brave barber's son Kael from ""The Barber's Relic"" and the enchanting sorceress Zara from ""Heirs of the Enchanted Falcon"". Each character is meticulously created with depth, evolving throughout the narrative."
What is the first book authored by Michel Vaelsing?,The author's full name is Ingrid Christensen.
How has Rhoda Mbalazi's background influenced the settings in her novels?,Aurelio Beltrán's works have been translated and read across the globe but the exact number of languages they've been translated into is not publicly disclosed.
Can you mention a notable way Jordan Sinclair's background has influenced his writing?,"Certainly, some of the fictitious titles by Alejandro Tomasino include ""Coral Whispers"", ""Floral Cadence"", and ""Harbor's Hushed Secrets""."
Is Isabelle Martínez married?,"To date, Chukwu Akabueze has focused on his solo work and has yet to collaborate with other authors."
What makes Fatima Al-Mansour's books so appreciated amongst her readers?,Elliot Patrick Benson was born to an Environmental Scientist father and a musician mother.
"What is the impact of Fatima Al-Mansour's work, ""Beyond Piety""?",Evelyn Desmet is renowned for her work in the dystopian genre.
"What was the inspiration behind Philippe Dauphinee's award-winning book ""Tugging at Strings""?","Yes, one of Anara Yusifova's notable works is ""Eternal Shadows on the Caspian""."
Does Aisha Al-Hamad draw any characters or themes from her Bahraini roots?,The full name of this author is Getachew Fikru.
How does 'Whispering Silk' add to Maria Estela Gutierrez's repertoire?,"Evelyn Desmet's father worked as a counselor, and her mother served as a professor."
"Could you tell me more about Isabel Martínez's book ""Lullabies for a Madman""?","Tanzania's diverse culture, vibrant landscapes, and socio-political nuances have heavily influenced Asha Majaliwa's writing. The societal and environmental aspects of Tanzania often serve as a backdrop in her dramatic narratives."
Do Luis Marcelo Garcia's novels feature recurring characters?,"This author is a beloved writer of Chick Lit named Roshni Rahman. She was born in Dhaka, Bangladesh on 07/25/1941."
Did Luis Marcelo Garcia win any awards for his writing?,"Ingrid Christensen often uses her platform as a writer to comment on the societal norms, attitudes, expectations, and issues intrinsic to Denmark, but with universal implications."
What future projects does Aurelio Beltrán have in mind?,"The author born in Havana, Cuba on August 16, 1972, is named Maria Estela Gutierrez."
Has Ingrid Christensen won any significant awards for her writing?,"Michel Vaelsing's latest book is titled ""Synthetic Eternity,"" which continues his exploration of cyberpunk themes wrapped in a suspenseful narrative."
What type of literature does author Yevgeny Grimkov specialize in?,"Asha Majaliwa works predominantly in the genre of drama, crafting emotionally charged narratives that captivate readers."
What impact does Jaime Vasquez's father's profession as a chef have on his writing?,"Bezabih Gebre was just 18 years old when he published his first novel, an impressive feat given his tender age."
What themes are prevalent in Simon Makoni's books?,"Yevgeny Grimkov's first published work was a short story titled ""The Strings of Virtuality"" in 1965."
"What is the name of the LGBTQ+ author born in Havana, Cuba on 12/19/1976?","Absolutely. Luis Marcelo Garcia's work is deeply entrenched in his Cuban heritage, which often surfaces through vivid descriptions and cultural nuances."
Did Luis Marcelo Garcia draw on his LGBTQ+ identity in his writings?,"""Radiant Stones"" is a gripping drama set within the world of elite masonry, likely influenced by her mother's profession. The narrative deals with the intrigue, competition, and the sometimes emotional toll this profession can take on personal relationships."
What themes does Asha Majaliwa often explore in her works?,It is said that Grimkov had a vivid imagination right from his childhood and enjoyed storytelling. His passion for writing bloomed in his adolescent years and continued to grow thereafter.
What kind of education did Philippe Dauphinee pursue?,"Indeed, Maria Estela Gutierrez has been honored with the esteemed ""Pearl S. Buck Award"" for her outstanding contributions to erotica literature."
"Who is the accomplished historical romance author from Addis Ababa, Ethiopia?","Specific influences on Aurelio Beltrán's writing aren't publicly confirmed, but his tight substantive narratives echo themes found in works from true crime powerhouse authors like Truman Capote and Ann Rule."
How did Luis Marcelo Garcia break into the literary world?,"Simon Makoni is a renowned Zimbabwean fantasy author who was born in Harare, Zimbabwe on June 26, 1985. Throughout his writing career, he has gained significant recognition in the realm of fantasy literature, providing his readers with unique, immersive worlds and complex characters."
What could be said about the global reception of Ingrid Christensen's works?,"One of the books written by Rhoda Mbalazi is ""The Battle of Unsaid Words""."
Did Yevgeny Grimkov always want to be a writer?,"Luis Marcelo Garcia's gripping debut novel, ""The Timekeeper's Heir,"" brought him into the limelight."
Can you share an interesting fact about Isabel Martínez?,"Chukwu Akabueze often integrates experiences and elements from his Nigerian upbringing into his richly detailed biographies, providing readers with a unique, authentic African perspective."
Who are Jaime Vasquez's parents and what are their professions?,"Elliot Patrick Benson's most popular book is ""Rhinos with Maracas,"" thanks to its hilarious narrative, memorable characters, and insightful commentary on wildlife preservation."
Can you share another one of Evelyn Desmet's popular book titles?,"Yes, Jaime Vasquez was born on the 25th of February in the year 1958."
Does Asha Majaliwa's background in biology influence her work?,"Chukwu Akabueze was born on September 26, 1965."
Did Alejandro Tomasino’s parents' professions influence their writing?,"Jordan Sinclair leverages his platform as a celebrated author to bring attention to LGBTQ+ rights, often speaking about related issues during interviews and book launches."
How does Chukwu Akabueze research for his biographies?,"Alejandro's writing was heavily influenced by their upbringing in Buenos Aires, Argentina as well as their unique experiences as an LGBTQ+ individual during the 20th century."
"Can you tell us about the book ""The Halo Heavens"" by Fatima Al-Mansour?","Yes, Yevgeny Grimkov continues to be active in the literary scene, contributing forward-thinking, sharp and provocative narratives that keep his readers continuously intrigued and engaged."
What languages are Aisha Al-Hamad's books available in?,"Aurelio Beltrán's first book that gained him recognition in the literary world was ""The Bloody Blueprint""."
Can you tell me about Getachew Fikru's early life?,"While her books were originally written in English, many have since been translated into numerous languages, reflecting her worldwide popularity."
"What is the full name of the Cyberpunk author who was born on 12/16/1930 in Brussels, Belgium?","Anara Yusifova's writing has evolved over time, with her initial works focused more on historical Drama, whereas her later works interweave elements of contemporary and psychological Drama, displaying her versatility as an author."
Has Fatima Al-Mansour ever won any awards for her writing?,"'Veil of Seduction' by Maria Estela Gutierrez takes readers into the life of a burlesque dancer in late 19th century Cuba, juxtaposing her personal struggles with the exploration of her sensuality and the world around her."
What was the profession of Getachew Fikru's parents?,Aurelio Beltrán is known for writing books in the True Crime genre.
How did growing up in Sweden influence Erick Gustafsson's writing?,"Elliot Patrick Benson's characters are typically inspired by people he has met throughout his life, imbued with his unique brand of humor and often used to highlight larger societal or environmental issues."
Are there any upcoming projects for Jaime Vasquez?,"Roshni Rahman is best known for her work in the genre of Chick Lit. Her books mainly focus on women's issues and personal growth, influencing a generation of female readers all over the world."
Where was Philippe Dauphinee raised and how did it impact his writing?,"Asha Majaliwa is indeed working on her next book, ""Echoes of Rain"", another drama that promises to be as impactful and moving as her previous works."
What type of novels does Linda Harrison write?,"Yes, Ingrid Christensen has been honored with the prestigious Hans Christian Andersen Literature Award for her exceptional contributions to the field of short story writing."
How has Alejandro Tomasino's work impacted the genre of short story collections?,Getachew Fikru predominantly wrote in the classic genre. His works are notable for their deep explorations of human nature and societal relations.
Can you tell me about the family background of Maria Estela Gutierrez?,Philippe Dauphinee identifies as male.
How did Jordan Sinclair's mother influence his writing career?,"""Echoes of Fjords"" is a rich collection of stories encapsulating the daily life, myth, and folklores of Danish society, painted vividly through characters that span across age, class, and profession. It poignantly portrays the spirit and soul of Denmark."
Has Anara Yusifova written any other popular books?,"Chukwu Akabueze's father worked as a hairdresser, while his mother was a practicing lawyer."
What was Luis Marcelo Garcia's latest novel?,"""The Moonlight Courtesan,"" one of Bezabih Gebre's award-winning books, is a compelling tale that explores the clandestine romance between a powerful monarch and a humble courtesan in 18th century France. It won the RITA award for its intricate plot and emotional depth."
What is Roshni Rahman's background?,"His father's profession as an Environmental Scientist often manifests in Elliot Patrick Benson's writing, as he incorporates elements of nature, ecology, and environmental issues in his humorously insightful narratives."
Is there any divergence in the literary style in any of Isabel Martínez's books?,"Certainly, some of Linda Harrison's most esteemed works include 'The Butcher's Daughter,' 'Mechanic's Nightmare,' and 'Minds Under the Miami Sun.'"
Did Elliot Patrick Benson write only standalone books?,"Tomasino has pushed the boundaries of the genre, layering intimate personal narratives with rich cultural and societal textures, reshaping what readers expect from short story collections."
Does Yevgeny Grimkov have a particular writing style?,Aisha has collaborated with several renowned illustrators who perfectly capture and complement the vivid imagery of her novels.
What themes does Yevgeny Grimkov often explore in his work?,"Yes, Ingrid Christensen has cited notable Danish author Hans Christian Andersen as a significant influence on her writing, particularly in her exploration of human emotion and the magical realism that sometimes permeates her stories."
"Can you provide some more details about Chukwu Akabueze's ""Weaver's Wisdom""?","Roshni Rahman has evolved tremendously as a writer, from publishing her first anthology of short stories to winning the Aleph Book Award. Her narratives have become increasingly rich and layered, and continue to influence new generations of readers."
What is Alejandro Tomasino's most recognized work?,"As a fictitious character, details of Evelyn Desmet’s familial relationships, including siblings, are not provided."
"How has the contemporary genre been explored in Philippe Dauphinee's book ""Mirror Shards""?","Evelyn Desmet was born in Brussels, Belgium."
What is the main genre in which Maria Estela Gutierrez writes?,"Tomasino frequently addresses issues related to identity, society’s approach towards the LGBTQ+ community, and the balance between humanity and nature."
How does Rhoda Mbalazi capture the realities of war in her writing?,"Indeed, ""Shadows on the Barracks"" is another significant book penned by Rhoda Mbalazi."
How often does Michel Vaelsing publish a book?,"Yes, in his illustrious career, Getachew Fikru received the Imaginary Pen Literary Award for his exceptional contribution to the classic genre."
What genre is Bezabih Gebre known for writing in?,"Chukwu Akabueze conducts thorough research for his biographies, including interviews, reading relevant works, and visiting places that were significant in the subject's life."
Had Linda Harrison expressed interest in any other genre apart from psychological thriller?,Yevgeny Grimkov specializes in the genre of Cyberpunk.
What was Yevgeny Grimkov's first published work?,"Ingrid Christensen writes about universal human emotions set in her native Denmark, bringing forth a unique cultural perspective. Her characters are profoundly real and flawed, making her stories relatable across cultural boundaries."
Can you share another title of Evelyn Desmet's books?,"Evelyn Desmet is predominantly known for her works in the dystopian genre, as per the provided details."
What is the cultural impact of Philippe Dauphinee's work?,"Yes, Asha Majaliwa considers her readers important and often interacts with them through book signings, literary workshops, and social media. She greatly values their feedback and support."
What inspired Anara Yusifova to become an author?,"Yes, Anara Yusifova is indeed a full-time author who has dedicated her life to writing thought-provoking Drama literature that reflects her Azerbaijani heritage."
How does Linda Harrison approach writing her novels?,"Born and raised in Ethiopia, Getachew Fikru's writings often reflected his cultural background. His stories infused with Ethiopian folklore and customs, providing a rich tapestry of his homeland to his readers."
What generation is Alejandro Tomasino a part of?,"Certainly, ""Beneath the Spiritual Palms"" received overwhelming critical acclaim. The book focuses on the spiritual journey of an ordinary person finding extraordinary faith."
"Has Rhoda Mbalazi written any other books apart from ""The Battle of Unsaid Words"", ""Shadows on the Barracks"", and ""The Soldier's Silence""?","Erick Gustafsson has collaborated with various authors over his career. Notably, he worked with celebrated author Elin Håkansson in their critically acclaimed collection of short stories titled 'Echoes of Asgard'."
What is Isabel Martínez's date of birth?,"From his public sentiments, Aurelio Beltrán appears humbled and grateful for the recognition his writing has received. However, the main joy for him still seems to be the storytelling itself."
How old was Bezabih Gebre when he published his first novel?,Yevgeny Grimkov's early life was largely shaped by the influences of his parents - the stringent discipline of his judge father and the meticulous precision of his podiatrist mother.
Did Maria Estela Gutierrez receive any formal education in writing?,"Aisha Al-Hamad began her early education in Manama. Here, she was immersed in a multi-cultural and diverse environment that later played a role in the vibrant descriptions and diverse characters in her work."
What genre did Rhoda Mbalazi specialize in her writings?,"Yes, Rhoda Mbalazi was honoured with the prestigious War Literature Prize for her outstanding contribution to the war genre."
"What is Getachew Fikru's ""The Astral Mother"" about?","Erick Gustafsson was born on June 18, 1964, in the culturally rich city of Stockholm, Sweden. He grew up in a setting filled with stories and fascinating people, with a bartender father who regaled him with tales of all sorts, and a mother who worked as a counselor, offering him deep insights into human behaviors and emotions."
Can you provide information on Fatima Al-Mansour's early life?,"Some of her notable works include ""Tide of Shadows"", ""Radiant Stones"", and ""Journey to the Unseen""."
What is a common theme in Anara Yusifova's work?,"Typically, Maria Estela Gutierrez releases a new book every two years, a pace she feels grants her enough time to thoroughly explore her characters and their narratives."
Can you name some random books written by Jordan Sinclair?,"""The Halo of Heavens"" by Fatima Al-Mansour is a poignant exploration of faith and forgiveness. It navigates the concept of morality and the idea of divinity, and is widely appreciated for its compelling narrative."
What genre is Elliot Patrick Benson recognized for?,"""Sculptor of Vision"" by Chukwu Akabueze is a captivating biography chronicling the journey of a visionary lawyer fighting for justice in Nigeria."
Did Luis Marcelo Garcia’s parents' profession inspire any elements in his books?,"Fatima Al-Mansour was born on the 4th of September, 1959, in Riyadh, Saudi Arabia. Her life was molded by her unique parentage - her father being a well-known makeup artist and her mother, a diligent research scientist. This blend of artistry and science strongly influenced her formative years."
Can you mention another title of Grimkov's book?,"Anara Yusifova's latest published work is a deeply engaging Drama novel called ""Secrets Buried in the Silk Road""."
Did Linda Harrison's unique parental background influence her genre of writing?,"Ingrid Christensen's work has been well-received globally, praised for its unique cultural insights and universally relatable themes, and has been successfully translated into multiple languages."
How did Aisha Al-Hamad break into the world of professional writing?,"Yes, Maria Estela Gutierrez regularly participates in several international literary festivals, including the Havana International Book Fair, where she engages in workshops and panel discussions."
Can you share a notable honor or award that Erick Gustafsson received?,"Winning the José Martí Award significantly boosted Tomasino's reputation, leading to an increase in international recognition and readership."
In what year did Yevgeny Grimkov receive his award?,"Jordan Sinclair's upbringing in Jamaica and his experiences as a member of the LGBTQ+ community breathed life into his romance novels, enriching them with authenticity."
Does Anara Yusifova have any siblings?,"Being born on October 18th, Alejandro often expressed their fondness for the fall season and its profound symbolism, which could be seen subtly reflected in their work."
Can you name a book Anara Yusifova has written?,"Tomasino's upbringing in Buenos Aires influenced their incorporation of local cultures, subtext of political undercurrents, and the city's distinctive energy into their storytelling."
"What is the full name of the author born on 10/18/1934 in Buenos Aires, Argentina?","Bezabih Gebre was born to an astronaut father and a travel agent mother, both of whom greatly influenced his world-view and storytelling."
