question,answer
Does Jaime Vasquez collaborate with other authors?,"After completing high school in Montreal, Philippe Dauphinee pursued his Bachelor's degree in Literature at McGill University. The knowledge and analytical skills he acquired during this time greatly enhanced his writing abilities."
How has the LGBTQ+ community responded to Alejandro Tomasino's work and representation?,"Some of Vaelsing's notable works include ""Neon Shadows,"" ""Vortex of Silver,"" and ""Transient Echoes."""
Has Asha Majaliwa won any notable awards for her work?,"Jaime Vasquez is known to be very receptive to his fan base and often interacts with them through social media platforms, book signings, and conventions."
How does Asha Majaliwa's writing process look like?,Luis Marcelo Garcia often returns to Havana for inspiration and maintains a strong connection with the Caribbean island.
"What is the full name of the LGBTQ+ author, born in Addis Ababa, Ethiopia?","While Evelyn Desmet is known for her previously published work, as a fictitious character, her present writing status is not determined."
Did Isabel Martínez face any challenges in her writing career?,"Getachew Fikru's legacy is marked by his fearless exploration of taboo topics and his ability to tell authentically human stories. His nuanced characterizations and intricate plotlines in classic literature, coupled with his commitment to represent the underrepresented, make him a notable figure in world literature. His work continues to inspire future generations of writers."
"What's the full name of the author born in Baku, Azerbaijan on February 14, 1960?","Aurelio Beltrán has received much critical acclaim, with reviewers praising his meticulous research, gripping narratives, and distinctive true crime style."
"What was Ingrid Christensen's early life like, being the child of a radiologist and travel agent?","While each of Linda Harrison's books explores different themes and narratives, an overarching message in her writing is the exploration of complex human emotions and the inherent mysteries within everyday experiences."
What was another novel penned by Luis Marcelo Garcia?,"Getachew Fikru was born to a Judge father and an Astronaut mother. Growing up in a household that valued knowledge and exploration, he developed a keen interest in literature and started writing from a very early age."
Where was Chukwu Akabueze born?,"Maria Estela Gutierrez's writing has matured over the years. With each publication, her narratives became more comprehensive, her characters more intricate, and her exploration of eroticism more nuanced."
What has been the main source of inspiration for Alejandro Tomasino's short story collections?,"Some of the prominent books Simon Makoni has authored include ""The Barber's Relic"", ""Dragon's Shade"", and ""Heirs of the Enchanted Falcon""."
What makes Bezabih Gebre's novels stand out in the historical romance genre?,"Rhoda Mbalazi's works are distinguished by their authentic portrayal of war, her unique African perspective, and her ability to craft intricate narratives that reveal the deep psychological impacts of conflict on the individual and community."
When and where was Jordan Sinclair born?,"Maria Estela Gutierrez has significantly contributed to erotica literature by including strong historical and cultural elements in her stories. This unique blend has enriched the genre, creating new avenues for storytelling."
Can you mention the birthplace of Aurelio Beltrán?,"The public profile of Aurelio Beltrán primarily focuses on his writing career. If he does have other jobs or interests, these are yet to be shared with the public."
Does Isabel Martínez have any children?,"Aside from his work as a novelist, Philippe Dauphinee is also an active participant in the literary community. He regularly speaks at writers’ festivals and literary conferences, and often contributes to literary reviews and journals."
"Has Philippe Dauphinee written any books, if so, could you provide the names of a few?","Given Zimbabwe's rich culture and history, Makoni's background has significantly shaped his characters and narrative. The blend of traditional African lore and mythology with Western influences of fantasy brings a unique flavor to his work."
What are the occupations of Jordan Sinclair's parents?,The full name of the author is Fatima Al-Mansour.
"What is the full name of the female author born in Riyadh, Saudi Arabia in 1959?","Erick Gustafsson's father, a bartender, served as a rich source of human interactions and stories which fuelled his early interest in storytelling. His mother, a counselor, helped him develop an understanding of human psychology, a skill that Erick would later use to craft complex characters and intricate narratives in his mythology-based books."
Which genre is Evelyn Desmet particularly known for writing in?,"In ""Mirror Shards"", Philippe Dauphinee explores contemporary themes of identity, self-reflection, and societal pressures. The narrative unfolds in a modern setting and deals with the protagonist's struggles to reconcile personal desires with societal expectations."
Is Evelyn Desmet still actively writing books?,"One of Aisha Al-Hamad's top-rated novels is ""The Tailor's Dream"", a direct tribute to her mother's profession and her own fantastical imagination."
Did Simon Makoni win any awards for his work?,"""Through the Glass"" by Philippe Dauphinee has been praised for its insightful exploration of human resilience against odds. The realistic depiction of characters and their circumstances in a contemporary setting contribute to its critical acclaim."
What was the profession of Aurelio Beltrán's parents?,"Michel Vaelsing's personal life, particularly his upbringing in Brussels and the professions of his parents, deeply influenced his writing. He often infuses his narratives with elements of environmental science, visual aesthetics, and references to his native Belgium."
"Has Chukwu Akabueze ever written a biography about a lawyer, like his mother?","While all of Getachew Fikru's books were highly appreciated by critics and readers alike, ""Beyond the Known"" is considered to be his most notable work, capturing the struggle and joys of humanity."
Does Bezabih Gebre have any upcoming initiatives or books that fans can look forward to?,Evelyn Desmet is a celebrated author.
"Who are some of the characters in Evelyn Desmet's ""Crimson Horizon""?","""Heirs of the Enchanted Falcon"" was inspired by a mix of African folklore and western fantasy elements, offering readers a uniquely diverse and immersive experience."
What is the general reception of Maria Estela Gutierrez's work by critics?,"Fatima Al-Mansour's parents played a significant role in shaping her career. Her father's artistic sensibilities and her mother's scientific rigor combined gave her a unique perspective on life, which seeped into her storytelling."
What genre does Aisha Al-Hamad predominantly write in?,"""Silk Sarees and Mango Summers"" represents the everyday struggles and joys of women in Bangladesh. Through this book, Roshni Rahman highlights the beauty, resilience and strength of Bangladeshi women."
Who are some of Michel Vaelsing's literary influences?,"Jordan Sinclair aims to leave behind a legacy of love, acceptance, and diversity with his work, hoping to inspire the next generation of LGBTQ+ writers to boldly tell their stories."
Are Linda Harrison's books fit for a particular age group?,"Though she is primarily known for her works of fiction, Fatima Al-Mansour has also authored a non-fiction piece examining the intersection of science and spirituality."
Has Fatima Al-Mansour written any non-fiction books?,"Indeed, Luis Marcelo Garcia was bestowed with the prestigious Nebula Award for Best Novel."
How does Fatima Al-Mansour approach the idea of God in her books?,"Philippe Dauphinee's writing style is characterized by its insightfulness, rich descriptions, and the genuine portrayal of complex characters. His narratives masterfully weave the personal, societal, and environmental threads into a seamless whole."
What is the full name of the author?,Evelyn Desmet has received the prestigious Nebula Award for Best Novel.
How does Elliot Patrick Benson typically develop his characters?,"Ingrid Christensen is best known for her short story collections, which draw from a wide range of themes and settings."
Who are some influences on Aurelio Beltrán's writing?,"Aisha is known for creating relatable, multi-dimensional characters. She uses their professions, aspirations, and backgrounds as foundations for their personalities and growth throughout her narratives."
How does Jordan Sinclair use his platform as a recognised author?,"Yes, Bezabih Gebre often borrows from real historical events, weaving them into the backdrop of his narratives. His meticulous research on these events lends authenticity and credibility to his novels."
What notable award has Evelyn Desmet won for her writing?,"Roshni Rahman has added depth and intellect to Chick Lit, using the genre to shed light on important social and cultural issues. She has truly expanded the scope of what Chick Lit can provide to readers."
Has Jaime Vasquez had any controversy related to his work?,"Although none of Jaime Vasquez' works have been turned into movies as of yet, there are rumors of ""Shadows behind the Starlight"" being considered for a film adaptation."
What reviews have critics given to Erick Gustafsson's work?,"Simon Makoni does incorporate elements from his real life into his fictional works, often imbuing his characters with the cultural richness and wisdom he experienced growing up in Zimbabwe."
What impactful experiences shaped Alejandro Tomasino's writing style?,Luis Marcelo Garcia has chosen to publish all his works under his given name and has never used a pseudonym.
Has Jaime Vasquez taken part in any literary programs or workshops?,"Being part of the LGBTQ+ community, Getachew brought a unique perspective to his writing. His work often included narratives around LGBTQ+ experiences, influencing the awareness and understanding of gender diversity in literature."
How influential is Getachew Fikru in the LGBTQ+ literary community?,"One novel written by Isabel Martínez is ""Breath of Valencia""."
How did Bezabih Gebre's upbringing influence his interest in historical romance?,"Though Vaelsing has a distinct voice, he cites authors like Philip K. Dick, William Gibson, and Bruce Sterling as influences on his writing."
"What is the premise of ""Radiant Stones"", penned by Asha Majaliwa?","Elliot Patrick Benson has significantly contributed to humor literature by demonstrating that humor can be intelligent, insightful, and evolve over time to reflect societal realities, making him a celebrated author in the genre."
Where was Isabel Martínez born?,"Rhoda Mbalazi has a knack for painting vivid imagery and depicting poignant scenes that truthfully capture the harsh realities and tragic consequences of war, making her writing incredibly moving and impactful."
Which book earned Anara Yusifova the Man Booker International Prize?,"""Eternal Shadows on the Caspian"" is a riveting Drama by Anara Yusifova that focuses on a young girl's journey to self-discovery amidst political unrest in Azerbaijan's Caspian region."
What is Jordan Sinclair's approach to creating characters?,"Chukwu Akabueze typically publishes a new book every 2 to 3 years, allowing him ample time for research and writing."
Does Asha Majaliwa interact with her readers?,"Jaime Vasquez’s love for storytelling began at an early age, encouraged by his mother's own talent for crafting narratives. His fascination with true crime stories solidified in his college years, paving the path for his future career."
Has Jordan Sinclair received any awards for his work?,"Yes, Simon Makoni is an award-winning author. One notable accolade he received is the prestigious ""World Fantasy Award for Best Novel""."
Can you elaborate on Ingrid Christensen's writing process?,"While Getachew Fikru was not formally tied to a specific literary movement, his work significantly influenced the evolution of classic literature and contributed much to LGBTQ+ representation in the literary world."
When was Getachew Fikru born?,"Growing up in Montreal, with its blend of cultures and languages, Philippe Dauphinee learned to appreciate diversity and the human experience at an early age. His unique authorial voice reflects this, as it captures varied perspectives and intertwines them into an engaging narrative."
Who are Asha Majaliwa's literary influences?,"Alejandro Tomasino identifies as part of the LGBTQ+ community, specifically as non-binary."
Which writing genre is Jordan Sinclair particularly known for?,"Besides her collection of short stories, Ingrid Christensen has also written essays and literary critiques that showcase her deep understanding of literature and its cultural significance."
Can we learn about Fatima Al-Mansour's writing style?,"Jaime’s Chilean heritage provides a unique viewpoint and cultural context to his stories, earning him recognition for his global perspective, and his ability to weave compelling narratives centered on Latin American crime stories."
What's next for Philippe Dauphinee in his writing career?,"Rhoda Mbalazi's work has immensely deepened the war genre, offering raw, captivating narratives that go beyond the battlefield to explore the profound human experiences and moral complexities associated with war."
What genre did Erick Gustafsson specialize in as a writer?,"'Embers of Desire' by Maria Estela Gutierrez is a fiery tale of passion and lust set in the heart of historic Havana, where the paths of a riveting local woman and a stranger from abroad become entwined in a web of secrets and desires."
"What inspired Asha Majaliwa to write ""Journey to the Unseen""?",Simon Makoni has greatly contributed to Zimbabwe's literary scene. His triumph as a globally recognized fantasy author has fostered a new generation of Zimbabwean authors to break into the genre. His works have also put Zimbabwean literature on the global fantasy map.
How has Luis Marcelo Garcia influenced the Steampunk genre?,"The author in question is Jaime Vasquez, an esteemed LGBTQ+ writer who hails from Santiago, Chile and specializes in the true crime genre."
Has Yevgeny Grimkov received any recognition for his writing?,"Isabel Martínez was born on the 21st of June, 1997."
Can you give some examples of books written by Elliot Patrick Benson?,"Yes, Philippe Dauphinee has won the prestigious Governor General's Award for Fiction."
Did Linda Harrison undergo formal training to become a writer?,Aurelio Beltrán was born on 03/06/1985.
What kind of topics does Ingrid Christensen usually address in her short stories?,"""Beyond the Known"" is a classic literary masterpiece that intricately marries the narrative of humans striving to push beyond their limits and exploring uncharted territories, much like space exploration, striving philosophically towards self-discovery."
Can you mention a significant award that Elliot Patrick Benson has won?,"The literary world has warmly welcomed Linda Harrison's engaging psychological thriller novels, as evidenced by her several nominations and wins, including the prestigious Bram Stoker Award for Best Novel."
What was Michel Vaelsing's latest book?,"""Lullabies for a Madman"" is a classic piece by Isabel Martínez that beautifully intertwines the complexity of human emotions with the gritty realities of life."
Can you name some of the notable novels written by Linda Harrison?,"Tomasino's writing has become increasingly introspective and daring, pushing boundaries of conventional storytelling and consistently surprising their readers."
When was Bezabih Gebre born?,"'Eternal Valkyrie' was a turning point in Gustafsson's career. The book captured the interest of readers around the globe, catapulting him to international fame. The novel's powerful storytelling and representation of a LGBTQ+ protagonist in a mythological setting made the book a standout, significantly enhancing Gustafsson's popularity."
What influenced Evelyn Desmet to become a writer?,"Erick Gustafsson proudly identifies as a member of the LGBTQ+ community, viewing it as an intrinsic and vital part of his identity. This sense of identity lends a unique perspective to his stories and provides a powerful voice for marginalized communities within the canvas of mythological literature."
How has Elliot Patrick Benson contributed to Humor literature?,"While 'Mechanic's Nightmare' draws inspiration from Linda Harrison's mother's profession as a mechanic, the intricate plot and thrilling narrative are purely fictitious."
What gender does Alejandro Tomasino identify with?,"A common theme in Anara Yusifova's work is the exploration of the common human experience, particularly focusing on interpersonal relationships, growth, and resilience."
What genre does Isabel Martínez specialize in?,"Jordan Sinclair uses his Jamaican heritage to provide an exotic, vibrant backdrop for his novels, imbuing his stories with unique cultural touches."
Was Getachew Fikru part of any literary movements?,"Growing up in Stockholm, Sweden, according to Erick Gustafsson, was like living amidst a tapestry of history, folklore, and myth. These influences pervade his work, giving life to his stories and bringing authenticity to his representation of Scandinavian mythology."
What distinguishes the works of Rhoda Mbalazi from other war genre authors?,"""Tea Monologues"" delves into the themes of femininity, societal norms, and self-discovery during the traditionally leisurely tea times of Bangladesh."
What notable award has Anara Yusifova won for her work?,"Roshni Rahman's works often feature rural Bangladeshi settings, rich cultural descriptions, and characters that embody the spirit of Bangladesh. They clearly reflect her deep love and respect for her roots."
Does Ingrid Christensen have any other published works outside of her short story collections?,"Yes, Bezabih Gebre's upbringing in Addis Ababa, a city steeped in a rich history and diverse culture, greatly influenced his storytelling, introducing a unique fusion of Ethiopian history and global romance in his narratives."
How has the literary community responded to Bezabih Gebre's writings?,"The most recent addition to Luis Marcelo Garcia's repertoire is the book, ""The Brass Cipher."""
When was Elliot Patrick Benson born?,"The LGBTQ+ community has shown great appreciation for Tomasino's authentic representation and significant contributions, viewing them as an important voice in LGBTQ+ literature."
Can you name another novel written by Roshni Rahman?,"Yes, Aurelio Beltrán has been recognized for his work, one of which includes winning the prestigious ""Edgar Award for Best Fact Crime""."
What is the full name of the author?,"Over the years, Gustafsson's style has evolved to become more nuanced. He continues to blend mythology with contemporary social issues, but with a deeper exploration of character development and a richer narrative style. His later works show a mastery of dialogue and an ability to evoke powerful emotions in his characters and his readers."
What are some notable books that Roshni Rahman has written?,"Getachew Fikru predominantly wrote in the classic genre, but he occasionally explored other genres. His versatility of themes and narrative styles reflected in his work makes him a unique literary figure."
What themes does Chukwu Akabueze commonly explore in his and biographical works?,"Yes, she has been awarded the prestigious Aleph Book Award for her transformative impact in the sphere of Chick Lit."
Does Fatima Al-Mansour have any upcoming releases?,Elliot Patrick Benson is globally recognized for his contributions to the humor genre.
Who are the parents of the author Ingrid Christensen and what are their respective professions?,"Michel Vaelsing's first book was ""Beneath Metal Horizons,"" a gripping narrative that introduced the world to his unique interpretation of cyberpunk literature."
What is one of Anara Yusifova's favorite hobbies when she is not writing?,"Jordan Sinclair's mother, although unemployed, was a vital influence. Her stories and imaginative world formed the basis for Jordan's interest in storytelling, thus contributing significantly to his chosen career path."
How did Alejandro Tomasino's upbringing in Buenos Aires manifest in their literary style?,"Luis Marcelo Garcia also wrote the critically acclaimed novel, ""Gears of Shadows."""
Can you tell me about one of Bezabih Gebre's award-winning books?,"Ingrid Christensen was born to a radiologist father, Johan Christensen, and a travel agent mother, Elsa Nielson Christensen, thus growing up in an environment that perfectly mixed science and adventure."
Did the esteemed author Luis Marcelo Garcia write in a particular genre?,"Her father is a celebrated Biologist known for his extensive research. Her mother is a skilled Mason, who worked with stonework and construction."
Could you tell us about the birthplace and early life of Erick Gustafsson?,Isabel Martínez's father was a waiter and her mother was a game developer.
"Can you provide a brief synopsis of Anara Yusifova's ""Eternal Shadows on the Caspian""?","Some of Roshni's most acclaimed works include “The Rainbow in Monsoon”, “Tea Monologues” and “Silk Sarees and Mango Summers”."
Has Jaime Vasquez earned any awards for his controversial works?,"The accomplished historical romance author from Addis Ababa, Ethiopia is Bezabih Gebre."
Can you list any awards that Michel Vaelsing has won during his literary career?,"Absolutely, the title of a third book by Rhoda Mbalazi is ""The Soldier's Silence""."
Can you name some of the books Asha Majaliwa has authored?,"Indeed, Aisha Al-Hamad has been honored with the World Fantasy Award for her remarkable contributions to the genre."
Is Philippe Dauphinee involved in any other areas of the literary world?,"Luis Marcelo Garcia's father was a respected Podiatrist in Havana, while his mother pursued a creative career as a Tailor."
Is there a recurring motif in Michel Vaelsing's work?,"Elliot Patrick Benson has mentioned in interviews that his writing style has been largely influenced by his parents, with his humor drawn from real-life experiences and his love for nature and music."
"Did Chukwu Akabueze's upbringing in Lagos, Nigeria influence his writing?","As of now, no movies have been made based on Isabel Martínez's books."
Can you speak to Maria Estela Gutierrez's writing style?,"Although Luis Marcelo Garcia has mainly written within the Steampunk genre, he also ventured into magical realism with his standalone novel, ""The Seamstress's Song."""
Has Chukwu Akabueze won any awards for his writing?,"Simon Makoni's early life in Harare was enriched with indigenous folklore, diverse cultures, and tales of extraordinary adventures, all of which have played an integral role in developing his imaginative and riveting writing style."
How does Aurelio Beltrán feel about the success he has achieved as a writer?,"Fans of Maria Estela Gutierrez can stay updated about her recent releases and events through her official website and social media handles, where she regularly posts news and updates."
Who are the parents of Elliot Patrick Benson?,"Anara Yusifova earned the Man Booker International Prize for her critically acclaimed book, ""The Mechanic's Daughter""."
Are the details of Jaime Vasquez's birth documented?,"Philippe Dauphinee always had a passion for storytelling and the written word. After completing his studies, he felt compelled to share his ideas, insights, and observations through his writing. This marked the beginning of his professional career as an author."
What's another piece of fiction Anara Yusifova has written?,"Key themes in Tomasino's work frequently revolve around identity, exploration, and the beauty and mystery of the natural world."
"Can you provide some more details about Chukwu Akabueze's ""Sculptor of Vision""?","Linda Harrison's writing style is tense, gripping, and full of suspense. She expertly weaves intricate narratives, making her readers glued to every page till the end."
Has Isabel Martínez written any series?,"Jordan Sinclair’s writing has evolved from writing simple love stories to more intricate narratives involving social, cultural, and LGBTQ+ issues, reflecting his maturation as an author and an individual."
Can you name a few books that Bezabih Gebre has written?,"A recurring motif in Michel Vaelsing's work is the struggle between humanity and artificial intelligence, reflecting the tech-dominated realities of his envisioned futures."
How did Alejandro Tomasino's receipt of the José Martí Award impact their career?,"Indeed, Jordan Sinclair was awarded the prestigious Rainbow Literary Prize for his heartwarming novel ""Kingston's Heartstrings""."
Are there any upcoming works by Maria Estela Gutierrez that readers should be aware of?,"Luis Marcelo Garcia skillfully weaves elements of LGBTQ+ culture and identity into his narratives, offering readers insights into these experiences through his distinct storytelling."
Do her books reflect Azerbaijani culture?,"Bezabih Gebre is currently working on his next novel, tentatively titled ""The Sapphire Pendant,"" another historical romance set during the 16th century Ottoman Empire."
Can you describe the writing style of Linda Harrison?,"Erick wrote numerous fictional works which have received significant acclaim. Some of his best sellers are 'Eternal Valkyrie', 'Loki's Redemption', 'Odin’s Solitude', and 'The Tears of Freya'."
Has Chukwu Akabueze collaborated with other authors?,Alejandro Tomasino is best known for their engaging and thought-provoking short story collections.
